reviewId,userName,userImage,content,score,thumbsUpCount,reviewCreatedVersion,at,replyContent,repliedAt,appVersion,language,content_english,sentiment,topics,vehicle_type,user_experience,usage_profile,is_pain_point,is_feature_request,competitor_mentioned
d8d64890-a0b9-47eb-a331-69e6794def4f,Johannes Kaiser,https://play-lh.googleusercontent.com/a/ACg8ocJ0dXfFVDFBhdd5yH96Y_We_g8RJ9YWGMTU2JCe7ItBIpdf=mo,"Eine Riesen Sauerei ist es da die Remote Cockpit Funktion am PC nicht mehr zur Verfügung steht. Das war sehr praktisch ohne Smartphone.Was die App betrifft:Habe bis vor kurzem beide Apps ( alt und neu) verwendet. Die neue könnte besser sein. In der alten App wurde noch der Reifendruck, Fahrzeug in Bewegung, etc. angezeigt. Auch fehlt mir die Funktion von der App zu sehen, wie viel km die letzte Fahrt war und den Verbrauch des Bordcomputers. Sowie die Anzeige des Bremsenverschleiß fehlt komplett.",1,23,1.5.2,2021-07-27 13:09:47,"Hi! Danke für Dein Feedback! Mit der Version 2.9.0 der My BMW App ist nun für Fahrzeuge mit OS7 und neuer die „Meine Fahrten“ Funktion verfügbar, mit der Du Informationen über Deine letzten Fahrten erhältst, inklusive Fahrtstatistiken zu Durchschnittsgeschwindigkeit, Dauer und Kraftstoffverbrauch. – My BMW App Support Team",2022-09-13 14:41:11,1.5.2,German,"It’s a real mess that the Remote Cockpit function is no longer available on the PC. That was very practical without a smartphone. As for the app: I’m using both apps (old and new) until recently. The new one could be better. The old app still showed tire pressure, vehicle in motion, etc. I also miss the function to see how many km the last trip was and the onboard computer’s consumption. And the brake wear indicator is completely missing.",negative,"vehicle status, usage statistics, remote controls, ui/ux",unclear,experienced_user,power_user,yes,yes,none
f8b9c4da-62c0-4081-89b0-562ffa76bdc1,Peter Katzmann,https://play-lh.googleusercontent.com/a-/ALV-UjVsFIN_vAhzgdCa2L6geVsZBPWKlf_oeEHOn2qeD1fpaR9TRgaE,"Funktioniert nicht, kommt andauernd es wäre ein technisches Problem aufgetreten. Über Kontakt eMail angeschrieben, keine Antwort. Wenn das die neuen digitalen Services sind, befinden wir uns immer noch in der Wüste ! Wirklich schade",1,3,1.5.2,2021-07-27 09:27:01,,,1.5.2,German,"""Doesn't work, constantly displays a message saying a technical problem has occurred. Contacted via email, no response. If this is the new digital services, we're still in the desert! Really a shame.""",negative,"performance, customer support",unclear,unclear,unclear,yes,no,none
bd695f50-3470-4223-9824-421fc9f8fd41,Thomas D.,https://play-lh.googleusercontent.com/a-/ALV-UjWQLE9V_EjDQCWlC-cTzc_g6cY5x6C6jvfjDliTJwYAw0bQbEk,Ein Update jagt das nächste und mit jedem Update werden (neue) Fehler beseitigt... Die alte App hatte diese Probleme nicht...,1,1,1.5.1,2021-07-27 05:50:42,,,1.5.1,German,One update chases the next and with each update (new) errors are eliminated... The old app didn't have these problems...,neutral,"updates, performance",unclear,experienced_user,unclear,yes,no,none
057d10e6-311f-4a59-9eda-267d693ebc2d,Bettina Reich,https://play-lh.googleusercontent.com/a-/ALV-UjXlbwzeOygL62T2gaP_EYQiRyCHLhq043ldbiJZrSCP3cf8ip0,Rückschritt zur alten App!,1,2,1.5.1,2021-07-26 14:36:33,,,1.5.1,German,"""Step back to the old app!""",negative,"ui/ux, updates",unclear,experienced_user,casual_user,yes,yes,none
fc0ad59e-a2bf-4ea4-998b-27639ed4b7b0,filon0935,https://play-lh.googleusercontent.com/a/ACg8ocK-v1gpy9qWvYgx9OCd9S6CQGXJJxvPbGkGffwWDvsLOQ9f1g=mo,Perfeckt,5,0,,2021-07-26 09:18:14,,,,German,"""Perfeckt""",positive,other,unclear,unclear,unclear,no,no,none
0b869af7-0c85-40a2-a4db-a70812a66cd4,Tom Sen,https://play-lh.googleusercontent.com/a/ACg8ocKZp6MlneYm59-V4i4R59mijLJjlH34QF7kgDiZA6pKu3CH=mo,"Ist mehr möglich ,ein netter Anfang jedoch genug Luft nach oben ... Update : seit einem Tag wieder alles Aktuel in der App und findet auch meinen X1 wieder !",3,0,1.5.1,2021-07-26 08:20:58,"Hi Thomas! Wir bedauern, dass Du diese Probleme mit My BMW App hast. Melde uns dieses Problem mit Angabe der ""ID142779"" möglichst detailliert über ""Feedback senden"" im Menü ""Profil"". Unser Entwicklerteam kann dann anhand der übermittelten Fahrzeugdaten überprüfen wo genau der Fehler in Deinem Fall liegt. - My BMW App Support Team",2021-07-26 08:14:27,1.5.1,German,"More is possible, a nice start, but there's still plenty of room for improvement... Update: Everything is current in the app again as of yesterday, and it finds my X1 again too!",positive,"performance, connectivity, vehicle status",unclear,experienced_user,casual_user,yes,no,none
4f6b4954-104e-46aa-b444-9153328b5143,Michael S.,https://play-lh.googleusercontent.com/a/ACg8ocKF_jlE0ufkbP7m6NDDIFNhes6Iz8EGUTC-RXhXP0UdMBvqww=mo,"Sinnvolle Daten, wie Strecke, Dauer und Verbrauch der letzten Fahrt wurden gestrichen. Dafür gibt's viel BMW Werbung",2,2,1.5.1,2021-07-25 11:26:17,"Hi! Danke für Dein Feedback! Mit der Version 2.9.0 der My BMW App ist nun für Fahrzeuge mit OS7 und neuer die „Meine Fahrten“ Funktion verfügbar, mit der Du Informationen über Deine letzten Fahrten erhältst, inklusive Fahrtstatistiken zu Durchschnittsgeschwindigkeit, Dauer und Kraftstoffverbrauch. – My BMW App Support Team",2022-09-13 14:43:46,1.5.1,German,"""Useful data, such as distance, duration, and consumption of the last journey have been removed. Instead, there’s a lot of BMW advertising.""",negative,"vehicle status, usage statistics, connected store",unclear,experienced_user,casual_user,yes,yes,none
f2997be0-09d0-4842-b19c-4385005c65d0,Klaus Arnold,https://play-lh.googleusercontent.com/a/ACg8ocIA0hGhJeNnT_6ohf6maPZnnLaJinfIjGkkqaJF7Zf0MRTk5A=mo,"Etwas frischere Optik, aber insgesamt eine Verschlimmerung zur bisherigen App.",2,2,1.5.1,2021-07-25 10:57:32,,,1.5.1,German,"“A somewhat fresher look, but overall a deterioration compared to the previous app.”",negative,"ui/ux, updates",unclear,experienced_user,unclear,yes,no,none
c904c737-48d4-4fc0-a8b1-8276b6456805,Eric Berger,https://play-lh.googleusercontent.com/a/ACg8ocI_qBYCEGijblSUEdFPn3OWOAEYzD_huPL5sE4w6S4Sp0abuA=mo,"F11 BJ 2015. Jetzt habt ihr es endgültig geschafft. Kein Kalender, keine News, kein Twitter. Und Remote ist schlechter geworden. Hauptsache es sieht cool aus, die Führung hat ja eh keine Ahnung.",2,4,1.5.1,2021-07-24 14:57:51,,,1.5.1,German,"F11, year of manufacture 2015. You’ve finally done it. No calendar, no news, no Twitter. And Remote has gotten worse. All that matters is that it looks cool, because management doesn't know what they're doing anyway.",negative,"ui/ux, remote controls, bmw connected ecosystem",unclear,experienced_user,casual_user,yes,yes,none
e181f70f-2468-4267-b1d8-df7ac678c1fe,Muhammad Jameel,https://play-lh.googleusercontent.com/a-/ALV-UjW1SKk9-tL8OXhPxRh5RezcWtFVnxUsGaWWfDSp0Q4lc5o5a-ID,Super,5,0,1.5.1,2021-07-24 11:25:28,,,1.5.1,German,"""Super""",positive,other,unclear,unclear,unclear,no,no,none
be8bd40a-3c5a-45e1-a16c-4e57a7abdcc0,Alexander Schibelius,https://play-lh.googleusercontent.com/a/ACg8ocJde3vdstkIXtsZv307hPhdCRSKvMB9o2qAp3R5mMNiFTysSQ=mo,Alles wichtige auf ein Blick,5,0,1.5.1,2021-07-23 23:37:30,,,1.5.1,German,"""Everything important at a glance""",positive,"ui/ux, vehicle status",unclear,unclear,casual_user,no,no,none
ccbf3cf2-b2ac-45af-bd53-5e0423c98804,Thomas E,https://play-lh.googleusercontent.com/a/ACg8ocK0Ay2ojh3vFsmwLWjlJceTjCKMP2y98_SaPkMRgkQuwtCuAQ=mo,"Was ist denn jetzt hier der große Durchbruch dieser App? Eigentlich das gleiche wie in der vorherigen, nur unübersichtlicher. Es wird immer noch mit Connected Drive über das Internet verbunden. Die unterschiedlichen Services sind immer noch genauso unübersichtlich arrangiert. Der einzige offensichtliche Unterschied ist, dass man jetzt auch über Alexa verbinden kann. Nur wo ist Alexa, wenn ich spazieren gehe, im Urlaub oder gerade in einem Restaurant sitze und die Einstellungen überprüfen möchte?",1,8,1.5.1,2021-07-23 22:21:44,,,1.5.1,German,"What's the big breakthrough for this app now? Basically the same as the previous one, only less organized. It still connects via Connected Drive over the internet. The different services are still arranged just as confusingly. The only obvious difference is that you can now also connect via Alexa. But where is Alexa when I’m going for a walk, on vacation, or just sitting in a restaurant and want to check the settings?",negative,"ui/ux, connectivity, vehicle status, voice assistant",unclear,experienced_user,casual_user,yes,no,none
11caccc9-14d1-4783-8942-0a8c75c71822,DJ Volkero,https://play-lh.googleusercontent.com/a/ACg8ocKNua4cFuF1QZTaibYRXvnn-CHokA1jssQxwBBBMZamX2qqqg=mo,Bin absolut begeistert.,5,0,1.5.1,2021-07-23 20:17:04,,,1.5.1,German,"""I'm absolutely thrilled.""",positive,other,unclear,unclear,unclear,no,no,none
ab23b29b-dad9-4d8a-8e52-0339b20747dd,Wolfram Nägele,https://play-lh.googleusercontent.com/a/ACg8ocLGX4rMQtGVMPh_hn5qF82gC8uuf8xM5M4RrXgCNpb_JNb88w=mo,Toll bin begeistert,5,0,1.5.1,2021-07-23 17:48:53,,,1.5.1,German,"""Great, I’m thrilled""",positive,other,unclear,unclear,unclear,no,no,none
02130ebc-d557-462a-a8de-72691829186c,Max Mustermann,https://play-lh.googleusercontent.com/a/ACg8ocK6F92a2rW0FffcvPjv-zg4OmCvcy2YqJ24Yesx7MEYKbS3VQ=mo,"Funktioniert bei meinem 2009 BMW 740d gar nicht mehr.Bei der Connected Drive App konnte man wenigstens die Türen auf und zumachen und den Standort abrufen, bei der My BMW App funktioniert nichts mehr und laut Hotline kann man das auch nicht mehr ändern. Dafür sind 89€ für 6 Monate in keinster Weise gerechtfertigt. BMW Online und Internet geht auch nicht. Warum bietet man das überhaupt zum Kauf an?",1,12,1.5.1,2021-07-23 16:48:36,,,1.5.1,German,"""Doesn't work at all anymore on my 2009 BMW 740d. With the Connected Drive app, at least you could open and close the doors and retrieve the location, but nothing works with the My BMW App anymore, and according to the hotline, that can’t be changed anymore. That is in no way justified for €89 for 6 months. BMW Online and the internet aren’t working either. Why offer it for sale at all?""",negative,"performance, connectivity, vehicle status, customer support, bmw digital premium",combustion,experienced_user,casual_user,yes,no,none
19c4c5f4-0825-43af-9425-be5a498566d0,Simon,https://play-lh.googleusercontent.com/a/ACg8ocILjgCjNxwaGmqX9WUAfAX0sqV5z4yUBoCbw3lONCze0ltVcg=mo,"Login funktioniert nicht. Werde auf die BMW website geleitet (im Browser), und nach dem Login dann zu google. Der Suchtext scheint irgendein Login-Token zu enthalten. Vermute das wollte sich die App abgreifen. Update: nachem ich chrome installiert und zum Standard gemacht habe, funktionierte der Login. Finde die neue App etwas unübersichtlicher, aber sie funktioniert immerhin. Klimaanlage-Temperatur kann man leider immer noch nicht einstellen. Danke für den Tipp mit chrome!",3,5,1.5.1,2021-07-23 13:25:08,"Hi Simon! Wir bedauern, dass Du aktuell Probleme bei der Nutzung der My BMW App hast. Unser Entwicklerteam arbeitet an einer Lösung. Anderen Nutzern hat es geholfen, den Standardbrowser auf Chrome zu ändern und alle Cookies zuzulassen. - My BMW App Support Team",2021-07-21 16:56:03,1.5.1,German,"""Login isn't working. I’m redirected to the BMW website (in the browser), and after logging in, it goes to Google. The search text seems to contain some kind of login token. I suspect the app wanted to grab that. Update: after I installed Chrome and made it the default, the login worked. I find the new app a bit less clear, but it at least works. Unfortunately, you still can’t adjust the air conditioning temperature. Thanks for the tip about Chrome!""",negative,"authentication, connectivity, ui/ux, remote controls",unclear,experienced_user,casual_user,yes,no,none
c2831b1b-bf00-4dac-96a2-97d8f0b0a99a,Michael Kalteis,https://play-lh.googleusercontent.com/a/ACg8ocLR0mW6f6nhTEBUa6IQENwSDyng7a9hQU_v12c5ZjZ5GVgNTw=mo,Mit der App funktioniert absolut nichts mehr. Keine Verbindung zum Fahrzeug möglich! Vorgänger-app hat noch einwandfrei funktioniert.,1,4,1.5.1,2021-07-22 19:00:45,,,1.5.1,German,"""Absolutely nothing works with this app anymore. No connection to the vehicle possible! The previous app still worked perfectly.""",negative,"connectivity, performance",unclear,experienced_user,unclear,yes,no,none
87224dcf-9e8f-41d1-bc3a-b027d6adea7c,Max Mustermann,https://play-lh.googleusercontent.com/a/ACg8ocJ4jy-o7ojjsD319EX8glbsLrjcOScbU8eHXUlqorolKaU5=mo,"Auf meinem S7 funktioniert die App problemlos. Die Frage ist nur wofür brauche ich die App? Die angezeigten Information sind ziemlich dünn (Kilometerstand, Tankinhalt und Restreichweite) mehr nicht! Jeder KIA Fahrer lacht einen aus damit. Wann der nächste Service ansteht ist im Alltag nicht wirklich interessant oder Werbeprospekte wie geil ein 150k € X5 ist. Danach schämt man sich fast für seinen F31.",2,3,1.5.1,2021-07-22 18:25:23,,,1.5.1,German,"""The app works perfectly fine on my S7. The question is, what do I actually need this app for? The displayed information is quite thin (mileage, fuel level, and remaining range) – that's it! Every Kia driver would laugh at that. When the next service is due isn't really interesting in everyday life, or promotional brochures like ‘look how great a €150,000 X5 is.’ After that, you're almost ashamed of your F31.”",negative,"vehicle status, service & maintenance, ui/ux",combustion,experienced_user,casual_user,yes,yes,kia
23a1dd83-6473-456c-b67a-29145b9ecc6a,henry rühl,https://play-lh.googleusercontent.com/a/ACg8ocKwYxNTJHdJaE0p5JDFWYPPdZoz-L4DdJiIUKm6mPJqUc2KSQ=mo,Sehr gut gemacht,5,0,1.5.1,2021-07-22 13:49:34,,,1.5.1,German,"""Very well done.""",positive,ui/ux,unclear,unclear,unclear,no,no,none
bbb394bc-2ab3-4a8d-9c81-56e897e441c3,Sedrick Heubel,https://play-lh.googleusercontent.com/a/ACg8ocLORTDWR6-K3kxirFjFNEhPkI4Ko446bo8AZsN3Wpd1enDUVA=mo,Kann mich seit 1 Woche nicht anmelden weil eine Fehlermeldung kommt. ECHT SUPER.....,1,1,,2021-07-22 07:18:50,"Hi! Wir bedauern, dass Du aktuell Probleme bei der Nutzung der My BMW App hast. Wir kennen das temporäre Problem und unser Entwicklungsteam arbeitet an einer Lösung. Solltest Du die Meldung ""Invalid Token"" angezeigt bekommen hat es anderen Nutzern geholfen, den Standardbrowser auf Chrome zu ändern und alle Cookies zuzulassen. - My BMW App Team",2021-07-27 16:54:17,,German,"""I haven’t been able to log in for a week because an error message keeps popping up. REALLY GREAT.....""",negative,"authentication, performance",unclear,unclear,casual_user,yes,no,none
8b68e4a2-d808-4e6a-9f66-bc444173afcb,Sascha Schneider,https://play-lh.googleusercontent.com/a/ACg8ocJZ2oZ0JZTBvZeAt6ETItm_u4VCZthpWyU5Nv5H5IYJWuU86g=mo,Anmeldung nicht mehr möglich.,4,0,1.5.1,2021-07-21 18:41:30,,,1.5.1,German,“Login no longer possible.”,negative,authentication,unclear,unclear,unclear,yes,no,none
dae16498-9731-4d34-8764-f3cc208451a4,Norbert Schroer,https://play-lh.googleusercontent.com/a-/ALV-UjXlThvO2N1f0HoL5Q3AH5ndF-zAk3KYKBjtMfF0SVvJ2JT7KN9b,"Die App ist soweit gut. Allerdings fehlt mir wie bei der alten Version, die Übersicht der ans Auto gesendeten Ziele.",3,0,1.5.0,2021-07-21 16:37:03,Hi Norbert! Danke für Dein Feedback! Deine Anregungen geben wir an unser Produktteam weiter. - My BMW App Support Team,2021-07-26 08:14:45,1.5.0,German,"The app is good so far. However, like in the old version, I miss the overview of destinations sent to the car.",neutral,trip planning,unclear,experienced_user,power_user,yes,yes,none
2d5ec6de-f1c7-4d25-927e-0c18efeb2138,Stefan Seul,https://play-lh.googleusercontent.com/a/ACg8ocKqMr01ZAxQanamGfN07N7NauhuTZLbVfzDwruKy4EOmHP5STI=mo,"Die App selbst ist ja ganz nett aufgebaut, aber leider funktioniert die Verbindung zum Fahrzeug auch nach 5 Jahren immer noch sehr unzuverlässig und ist deshalb meistens nutzlos. Wieso können das andere Elektroauto Hersteller viel Besser?",1,2,1.5.1,2021-07-21 11:26:11,,,1.5.1,German,"The app itself is quite nicely designed, but unfortunately, the connection to the vehicle is still very unreliable after 5 years and is therefore mostly useless. Why can other electric vehicle manufacturers do it much better?",negative,"ui/ux, connectivity, ev-specific features",ev_hybrid,experienced_user,casual_user,yes,yes,electric vehicle manufacturers
4a3d0954-673c-4251-9123-034f726254aa,Der Sebbi,https://play-lh.googleusercontent.com/a-/ALV-UjUN6WE1ux2hxQfWSlLxp1at8RUd8OOTllboREHxH6Dp4DC8nhX5fg,"Kann mein Fahrzeug nur orten lassen wenn ich bis zu 1.5km in der Nähe bin ! Wow, was für ein Schwachsinn!!! Dafür verlangt man noch Geld..",1,3,1.5.1,2021-07-21 00:03:31,,,1.5.1,German,"“I can only have my vehicle located when I’m within 1.5km! Wow, what nonsense!!! And they still charge money for that…”",negative,"vehicle status, connectivity, bmw digital premium",unclear,unclear,casual_user,yes,yes,none
06a7dfcc-1de0-4463-bfea-3bafa14b4dce,ichiban senshi,https://play-lh.googleusercontent.com/a-/ALV-UjXHvzbtw1Ib-Wh90PnV19mblca1yO_oUnQKAVc2-7S0woH_8_-z,Nutzlose App und was BWM geboten hat mit dem wechsel von iDrive 6 zu 7 ist ja Kundenverarsche par excellence. Bei id6 läuft ja weder Android Auto und neuerdings auch andere Apps nicht mehr wie z.B. Spotify und ein upgrade auf ID7 sei nicht geplant. Ich habe mein neues Auto 6! Monate vor ID7 release gekauft und niemand hat das nur ansatzweise erwähnt. Der Witz am ganzen ist das der X3 erst gerade in der 2019er Version rausgekommen war.,1,4,1.5.1,2021-07-19 22:53:51,,,1.5.1,German,"Useless app and what BMW has offered with the transition from iDrive 6 to 7 is blatant customer deception. With id6, Android Auto doesn't work, and recently other apps no longer work either, like Spotify, and an upgrade to ID7 is not planned. I bought my new car 6 months before the ID7 release, and nobody mentioned that even remotely. The funny thing about it all is that the X3 only just came out in the 2019 version.",negative,"connectivity, multimedia integration, smartphone integration, updates",unclear,experienced_user,casual_user,yes,no,none
d90ccb39-5fc3-40f1-835b-95dabc6ffc11,Dominik Freeze,https://play-lh.googleusercontent.com/a-/ALV-UjUJF7tc0AODFliCDN3BePSxdzPqFs_Fg1RmFRNETZwX1uk8EhwC,"Funktioniert zwar wunderbar, aber über 110MB ist nicht euer Ernst, oder? ;-)",4,0,1.5.0,2021-07-19 21:06:04,,,1.5.0,German,"It works wonderfully, but over 110MB, you’re serious, right? ;-)""",positive,"performance, mobile features",unclear,unclear,casual_user,yes,no,none
05e9b66f-c4b3-47a5-80bd-34f184a2a91d,Otto Kneitinger,https://play-lh.googleusercontent.com/a/ACg8ocLxoFTwqVDjgyrdMJAX__xxCLSf32VoIQ7_cpa1aEFL7WGGuw=mo,Ok,5,0,1.5.0,2021-07-19 17:11:09,,,1.5.0,German,Ok,neutral,other,unclear,unclear,unclear,no,no,none
0ce6c7fc-858d-428b-a036-4ed3f570d00e,Oliver Nerbas,https://play-lh.googleusercontent.com/a-/ALV-UjU9Jzwk2mtNHuChsHTPQi2vsIR4nmv1bPe1pU8nwKAT3UQBIcH-,sehr gut funktionierende App. Nachrichten nach Erledigung könnten schneller gelöscht werden,4,0,1.5.0,2021-07-19 15:56:04,,,1.5.0,German,Very well-functioning app. Messages after completion could be deleted faster.,positive,"performance, mobile features",unclear,experienced_user,casual_user,yes,yes,none
7d810616-df22-4f75-9302-cb01a048dd48,Taner Kececi,https://play-lh.googleusercontent.com/a-/ALV-UjWSCPO18FS05W3-UMxVaPdwiIODEoOkkZs2Q6EFcn7E3Rzh2160,Ortung vom Fahrzeug funktioniert nicht.,2,1,1.5.1,2021-07-19 15:25:28,,,1.5.1,German,Vehicle location isn’t working.,negative,vehicle status,unclear,unclear,casual_user,yes,no,none
aeaa0fca-454c-4ee1-a530-2e77d6fb62ce,P. Schmitz,https://play-lh.googleusercontent.com/a-/ALV-UjX4ZKTCU7fQ6lm61_Gy_Dfbk4ucyNGw3xRYoUiILYFmyNF1ivg,"Das eine App abgelöst zu Gunsten einer neuen App ist ok. Aber warum werden die Daten (Login) nicht übernommen wenn man zu dem Wechsel gezwungen wird 😡. Zudem war die Ankündigung kaum da, und zack wurde man aus der alten App ""ausgeschlossen"". Solche kleinen Dinge nerven ungemein und trüben insgesamt immer den Eindruck. Das geht besser. Da ich die App noch nicht verwendet habe (da unterwegs) kann ich noch nichts zum Inhalt dieser App beschreiben.",1,6,1.5.0,2021-07-19 13:41:39,,,1.5.0,German,"It's okay that one app has been replaced by a new one. But why aren't the data (login) taken over when you're forced to switch 😡. Plus, the announcement was hardly there, and suddenly you were ""excluded"" from the old app. Such small things are extremely annoying and always cloud the overall impression. It could be better. Since I haven't used the app yet (as I'm on the road), I can't describe the content of this app yet.",negative,"authentication, updates, bmw connected ecosystem",unclear,experienced_user,casual_user,yes,no,none
0f8ffac7-1d55-494d-9254-405b8e226a5e,Benni Hilker,https://play-lh.googleusercontent.com/a-/ALV-UjVTOjH7fK1ODgHokDZHYk1zOJ-ZRCIhebdpZS4WzbqXraG1vGDa,"Edrive Funktion ""letzte Fahrten"" fehlt",1,2,1.5.1,2021-07-19 13:36:32,"Hi! Danke für Dein Feedback! Mit der Version 2.9.0 der My BMW App ist nun für Fahrzeuge mit OS7 und neuer die „Meine Fahrten“ Funktion verfügbar, mit der Du Informationen über Deine letzten Fahrten erhältst, inklusive Fahrtstatistiken zu Durchschnittsgeschwindigkeit, Dauer und Kraftstoffverbrauch. – My BMW App Support Team",2022-09-13 14:45:00,1.5.1,German,"eDrive function ""last journeys"" is missing.",negative,ev-specific features,ev_hybrid,experienced_user,power_user,yes,yes,none
58f86a2b-1476-42eb-97ee-e5c6b8ede2c9,Sebastian Herber,https://play-lh.googleusercontent.com/a-/ALV-UjWMSpt_jtBaKjtHM16ueg7LNJT2HYpOVRdeOazoHasU_T3CJpqS,Für unseren BMW i3,5,0,1.5.0,2021-07-19 07:52:58,,,1.5.0,German,"""For our BMW i3""",neutral,"ev-specific features, vehicle status",ev_hybrid,unclear,unclear,no,no,none
fc1c0232-4b2f-44ec-8f26-b4d2ec394071,Daniel Goetz,https://play-lh.googleusercontent.com/a/ACg8ocLMh7kCflwHKpkljWfufE3QRZt9gAlZfP84wh7nEDw-Brn5YQ=mo,Funktioniert mit Samsung S7 nicht mehr,1,1,1.5.0,2021-07-18 22:08:50,,,1.5.0,German,"""No longer works with Samsung S7""",negative,"connectivity, smartphone integration",unclear,experienced_user,casual_user,yes,no,none
63c84cac-a90b-490d-a1dd-c8d458239151,Simone Kramski,https://play-lh.googleusercontent.com/a/ACg8ocL0n7ybJ8IFIwcpyD9M1sUS6_j96tRC8vicByoNU0N-Ru4hTg=mo,"App eigentlich gut aufgebaut. Aber aktualisiert nicht. Fahrzeugfinder funktioniert auch nicht. 3 Std nach zu Hause sein, war der Wagen angeblich immer noch in der Arbeit geparkt. BMW bitte richten !!",2,2,1.5.0,2021-07-18 19:26:58,,,1.5.0,German,"""App is actually well structured. But it doesn't update. Vehicle finder isn't working either. 3 hours after being home, the car was supposedly still parked at work. BMW please fix!!""",negative,"ui/ux, performance, connectivity, vehicle status",unclear,unclear,casual_user,yes,no,none
2175d853-7b35-4c12-b653-f57b596c7957,Martin Mueller,https://play-lh.googleusercontent.com/a/ACg8ocJz-DfuAUSkQXaHj3bMCyRt1ETgFyTol2wQcPqMI6R3JE6Nsw=mo,"Nicht schlecht, kann sicher noch mehr. PC Lösung wäre auf Dauer eine wertvolle Ergänzung. Dabei Fahrzeuginfo noch besser für Fahrtenplanung oder Fahrtenbuch.",4,0,1.5.0,2021-07-18 17:41:14,,,1.5.0,German,"Not bad, could definitely do more. A PC solution would be a valuable addition in the long run. Vehicle information could be even better for trip planning or a mileage log.",neutral,"vehicle status, trip planning, usage statistics",unclear,experienced_user,power_user,yes,yes,none
9ed423d2-bc4b-4d4f-899b-46cea240230b,D Bauernfeind,https://play-lh.googleusercontent.com/a/ACg8ocJE1kOzrhOrOEDTp1izBP-BNfpxLNt_qKBgr3EG4wvmUkbBoi_t=mo,Neue App schlecht,1,2,1.5.0,2021-07-18 15:39:05,,,1.5.0,German,"""New app bad""",negative,"ui/ux, performance, updates",unclear,unclear,unclear,yes,no,none
f15106f6-0fac-48c7-92f6-4f55ce728cdb,E.F. Schatz,https://play-lh.googleusercontent.com/a-/ALV-UjU35Sl5bdts3aknXIMKINzJINmPbuslEY2ZkI4eLo4eOFuCzJmO,Professionelles arbeiten,4,0,1.5.0,2021-07-18 09:32:49,,,1.5.0,German,"""Professional work""",positive,other,unclear,unclear,unclear,no,no,none
8fa08e47-7374-4923-a656-1b4208740e6d,M Engel,https://play-lh.googleusercontent.com/a/ACg8ocIdZcNPyo2d9p9vn24fp9X2YwhFUN0vGKAeKfHqwdzjNgwjOg=mo,"Alte App abgeschaltet, komme nicht in die neue rein weil ich als allererstes gefragt werde Google Standortdienste zu aktivieren und ein Nein nicht akzeptiert wird - Endlosschleife - traurig, das sich BMW sowas leistet. Selten so viele schlechte Bewertungen gesehen",1,7,1.5.0,2021-07-17 23:40:20,,,1.5.0,German,"Old app shut down, I can't get into the new one because I’m first asked to activate Google location services and a ""no"" is not accepted - endless loop - sad that BMW allows itself to do this. Rarely seen so many bad reviews.",negative,"authentication, connectivity, ui/ux",unclear,experienced_user,casual_user,yes,no,none
ddc29d09-777a-441a-9cfb-9f81eda393f9,Christoph Zehnder,https://play-lh.googleusercontent.com/a/ACg8ocKGhNBNonZpiZmLS-GYLSfT593d6u0qv1CzMiMD7m3Ul4snIw=mo,Der Zähler der Kilowatts ist der Hammer.,5,0,1.5.0,2021-07-17 23:05:21,,,1.5.0,German,"""The kilowatt counter is amazing.""",positive,"ev-specific features, usage statistics",ev_hybrid,unclear,power_user,no,no,none
