reviewId,userName,userImage,content,score,thumbsUpCount,reviewCreatedVersion,at,replyContent,repliedAt,appVersion,language,content_english,sentiment,topics,vehicle_type,user_experience,usage_profile,is_pain_point,is_feature_request,competitor_mentioned
70b495ed-f5c2-4315-9cac-81fa644a838d,Nikolaij Lankoff,https://play-lh.googleusercontent.com/a-/ALV-UjXOD0tIOXa9gKI7YuBrwmXDXfE8u_RICN7WM37X836JdIqWQlfA,"App macht stellt Basisfunktionen zur Verfügung. Super, dass BMW sich an die Weiterentwicklung gemacht hat. Jetzt noch ein paar coole Features von Tesla anschauen und die App bekommt noch mehr Möglichkeiten. Anmerkung: könnte man abfragen, ob es ein Firmware Update gibt?",5,0,1.6.2,2021-09-27 20:42:48,"Hallo Nikolaij! Vielen Dank für Dein Feedback. Mit der aktuellen Version 1.1.0 der My BMW App haben wir kürzlich einige neue Features ergänzt. Unser Entwicklerteam arbeitet mit Hochdruck an weiteren Funktionen für künftige Releases. Dabei liegt unser Fokus auf Nutzerfreundlichkeit, Sicherheit und Stabilität. - My BMW App Support Team",2020-10-26 11:00:18,1.6.2,German,"""App makes basic functions available. Great that BMW has started development. Now take a look at a few cool features from Tesla and the app gets even more possibilities. Note: could there be a query for whether a firmware update is available?""",neutral,"vehicle status, updates, ev-specific features",unclear,unclear,casual_user,yes,yes,tesla
21dd66d8-a608-4aa4-84cb-8d8e27ad7ba2,Jörg Abel,https://play-lh.googleusercontent.com/a-/ALV-UjXUo9FbYKORQ6XBy3y_KUV1D_nvOFtbPa4f8mUrq69dqpDbukH2,124 MB für eine nutzlose App. Ständig Updates ohne erkennbaren Fortschritt. App aktualisiert die Autodaten nicht. Support antwortet nicht. Eine Schande.....,1,1,1.6.2,2021-09-27 20:25:00,,,1.6.2,German,"""124 MB for a useless app. Constant updates without any discernible progress. The app doesn’t update the car data. Support doesn’t respond. A disgrace.....""",negative,"performance, vehicle status, updates, customer support",unclear,experienced_user,casual_user,yes,no,none
20f6756b-0828-4cac-ba4e-05b900d05cdd,sc sb,https://play-lh.googleusercontent.com/a/ACg8ocI_z52aa9fuKqCk9e4ZyAxsfIvEydbWHsuH6Ks1vGFqNFWiSw=mo,Leider erfolgt neuerdings die Aktualisierung mit dem Fahrzeugfinder um Stunden zeitversetzt. Damit ist nicht erkennbar wo das Fahrzeug in diesem Moment ist. Bitte dringend wieder reparieren! Danke,2,1,,2021-09-27 17:17:42,,,,German,"""Unfortunately, the vehicle finder update has recently started occurring with a delay of hours. This means it's no longer possible to see where the vehicle is at that moment. Please urgently fix this again! Thanks""",negative,"vehicle status, connectivity, updates",unclear,experienced_user,casual_user,yes,no,none
c5f3a10e-ed63-403b-a19e-24a08095ece5,Klaus Gruner,https://play-lh.googleusercontent.com/a/ACg8ocKtjEr3LWq4dmM65yuNIztHffYu_YCyP7Vb72ayp0XeMplzIQ=mo,Alle wichtigen Daten können überprüft werden,5,0,1.6.2,2021-09-27 16:56:52,,,1.6.2,German,"""All important data can be checked.""",neutral,vehicle status,unclear,unclear,casual_user,no,no,none
23c0ec9b-b212-46d7-a654-d0fab6d2c074,Peter Kleinschmidt,https://play-lh.googleusercontent.com/a-/ALV-UjVHAYGVRJ5h3Z8MwGw6-VMqUQbqCjtatBjI9mDYBF8fPXFUqapB,"sehr gute App, kann man wirklich empfehlen leider findet sie das Frz nicht immer ansonsten hätte ich 5 Sterne vergeben",4,0,1.6.2,2021-09-27 16:54:44,,,1.6.2,German,"very good app, can really recommend it, unfortunately, it doesn't always find the car otherwise I would have given 5 stars.",positive,"vehicle status, connectivity",unclear,unclear,casual_user,yes,no,none
00d16591-489c-4cc2-9d32-72e3a7cf9fc4,Thomas Nitsche,https://play-lh.googleusercontent.com/a/ACg8ocLBR3e0mzxqFSz-68xePmpqIg7ATabinavp7a4_zhFxUcxcdA=mo,Hab mich leider über die App geärgert. Auf einmal kompletter Datensatz weg und musste alles neu eingeben. Historie weg. Nix mit Fern-Klimatisieren etc,1,1,1.5.2,2021-09-27 13:16:16,,,1.5.2,German,"“Unfortunately, I’m annoyed with the app. Suddenly, the entire dataset was gone, and I had to enter everything again. History gone. Nothing with remote climatization etc.”",negative,"performance, remote controls, data & privacy",ev_hybrid,experienced_user,power_user,yes,no,none
6df65a2e-03b2-4f13-b7bd-0833a4673566,Alexander Zurbriggen,https://play-lh.googleusercontent.com/a/ACg8ocKuCthCvY93HDgcDanfG0a2WWhOXFic_-yNKF5TAC5mgZB28Q=mo,Einfach zu bedienen und sehr hilfreich. Vor allem das Planen von Reisen gefällt mi,5,0,1.5.2,2021-09-27 11:24:42,,,1.5.2,German,Easy to use and very helpful. I especially like planning trips.,positive,"ui/ux, trip planning",unclear,unclear,casual_user,no,no,none
113bfa27-5228-4291-b01c-f50c232ffe68,A. S.,https://play-lh.googleusercontent.com/a/ACg8ocLCIcmUNUUo7uiYu1v7f3IspoBCIfpJT2zOt34_czIiILGhBA=mo,"Favorit ""Zuhause"" lässt sich nach Festlegung nicht mehr ändern/löschen! EDIT: GEHT JETZT - S. ANTWORT UNTEN. Und wo sind die edrive-Infos hin? Enthält leider auch reichlich BMW-Werbung (Die Connected App war werbefrei!) Dazu gefiel mir das Design bzw. Layout der Connected App DEUTLICH besser: dezenter (""ALLES OK"" - Geht das in noch größerer Schrift?), strukturierter und eine ansprechendere Fahrzeuggrafik. Einzige Verbesserung ist die direkte Verlinkung der fahrzeugspezifischen Betriebsanleitung.",1,10,1.6.2,2021-09-26 21:25:35,"Hi! Danke für Dein Feedback! Mit der Version 2.9.0 der My BMW App ist nun für Fahrzeuge mit OS7 und neuer die „Meine Fahrten“ Funktion verfügbar, mit der Du Informationen über Deine letzten Fahrten erhältst, inklusive Fahrtstatistiken zu Durchschnittsgeschwindigkeit, Dauer und Kraftstoffverbrauch. – My BMW App Support Team",2022-09-13 13:48:29,1.6.2,German,"""Favorite ""Home"" can no longer be changed/deleted after being set! EDIT: WORKS NOW - SEE ANSWER BELOW. And where did the eDrive info go? Unfortunately, it also contains quite a bit of BMW advertising (The Connected App was ad-free!) I also much preferred the design/layout of the Connected App: more subtle (""ALL OK"" - Can that be in a larger font?), more structured, and a more appealing vehicle graphic. Only improvement is the direct linking of the vehicle-specific operating manual.""",neutral,"ui/ux, vehicle status, bmw connected ecosystem",ev_hybrid,experienced_user,casual_user,yes,yes,none
2aa438ce-c336-408d-8689-be24a6bcd5f5,Stefan Möller,https://play-lh.googleusercontent.com/a-/ALV-UjWNt9edKcWS1gDHyJUMGWI-fNzpFYYvOq-6o4xh-eBuKegpRKMB,Die myBMW App ist im Vergleich zur ehemaligen BMW Connected App ein echter Fortschritt und funktioniert zuverlässig.,5,0,1.6.2,2021-09-26 14:27:29,,,1.6.2,German,The MyBMW App is a real improvement compared to the former BMW Connected App and functions reliably.,positive,"performance, bmw connected ecosystem",unclear,experienced_user,casual_user,no,no,none
b27f436d-2d63-4a79-a7e0-e4cbf7150082,Steffen Romeis,https://play-lh.googleusercontent.com/a/ACg8ocJ-ekQvwc8aWV837HgIboPbZOrnl5NBS-1HAWrQOEeEiUWHIQ=mo,"Habe einen X3 aus Bj.2016, Fahrzeug wird gefunden, aber die vielen Informationen, die laut Beschreibung der App abrufbar sein sollen, funktioniert nicht. In der alten App wurde mir mehr angezeigt! In der alten Version wurden mir mehr Daten angezeigt und in der neuen Version hatte ich auch Informationen wie Tankinhalt, Reichweite, plötzlich geht es nicht mehr? Der X3 ist Bj. 09.2016",1,3,1.6.2,2021-09-26 14:07:26,"Hi! Die My BMW App ist für Fz. ab 07/2016 optimiert, die über die technische Ausstattung verfügen, regelmäßige Updates zum Fahrzeugstatus zu senden. Die Anzeige der Fahrzeugdaten via USB/ Bluetooth ist für Fz. mit der Sonderausstattung “BMW Apps” (SA 6NR) verfügbar. In künftigen Release folgt diese Anzeige für weitere Fahrzeuge. - My BMW App Team
",2021-09-07 15:28:47,1.6.2,German,"“I have an X3 from the year 2016, the vehicle is found, but the many information items that are supposed to be accessible according to the app description don't work. In the old app, I was shown more information! The old version showed me more data, and in the new version, I also had information like fuel level and range, suddenly it doesn't work anymore? The X3 is from 09/2016.”",negative,"vehicle status, updates",combustion,experienced_user,casual_user,yes,yes,none
61b9f295-a373-4275-b2d6-2344ee37594c,Matthias Müller,https://play-lh.googleusercontent.com/a/ACg8ocJAWX7o5Ezb2-fcD6Vffxppn3RmDXJW0lWGRGk2VZHKy3Sw9Q=mo,topppp,5,0,1.6.2,2021-09-25 16:04:27,,,1.6.2,German,topppp,positive,other,unclear,unclear,unclear,no,no,none
53d9d4da-31a6-4965-b14c-e8f2b449d2c7,Jürgen Linner,https://play-lh.googleusercontent.com/a/ACg8ocKZpMkjnwLnxsGOWoeE8qvXox1TD1Ki91MSXQjUDYVBHqXiPg=mo,Sehr gute App,5,0,1.6.2,2021-09-25 14:14:58,,,1.6.2,German,"""Very good app""",positive,other,unclear,unclear,casual_user,no,no,none
329477d8-c591-4cdc-bc4b-4eb6fdbbb288,Artur Koelcue,https://play-lh.googleusercontent.com/a-/ALV-UjUOaXEVbOBhjhvHTD4-V0ytUrm1qXSHVlBPnBUFb4TMyxOg8yzy6Q,Tolle und gelungene App,5,0,1.6.0,2021-09-24 22:03:13,,,1.6.0,German,"""Great and well-executed app""",positive,ui/ux,unclear,unclear,unclear,no,no,none
f9196be0-3c46-4491-bde9-5a938b82f8d0,Peter Weig,https://play-lh.googleusercontent.com/a/ACg8ocKChLzOcc5Ais2gCWkdpMZ2Jn6LrMTHwuvqzW4yX67cTwRqdQ=mo,Macht alles was ich brauche. Die Routenplanung am Handy mit Synchronisation des Navis funktioniert einwandfrei.,5,1,1.6.2,2021-09-24 18:01:32,,,1.6.2,German,Does everything I need. Route planning on the phone with synchronization of the navigation works flawlessly.,positive,"trip planning, map/navigation",unclear,experienced_user,power_user,no,no,none
f18653ff-020b-46c1-bb6d-c8d9fa6dadef,Michael Lerner,https://play-lh.googleusercontent.com/a/ACg8ocIP9WO2Ms6uLrh2TH3uVL0NeJ9NGhL80TqTnfg1E6r_LmCk1g=mo,"so macht BMW noch mehr Spaß. Ladeüberwachung Hybrid, starten der Klimatisierung usw. TOLL",5,0,1.6.2,2021-09-24 16:14:01,,,1.6.2,German,"""This is how BMW becomes even more fun. Charging monitoring for hybrid vehicles, starting the climate control, etc. AWESOME.""",positive,"vehicle status, remote controls, charging management, ev-specific features",ev_hybrid,unclear,power_user,no,yes,none
53f76b13-3763-4551-a2c7-1898fe8ff032,Horst Kabas,https://play-lh.googleusercontent.com/a-/ALV-UjWGgGjTNyoiZlaQmR3SzLWoaheXXsFOIUKP33OaFNti_Ffqv--a,Funktioniert einwandfrei,5,0,1.6.2,2021-09-24 13:33:00,,,1.6.2,German,"""Works flawlessly.""",positive,performance,unclear,unclear,casual_user,no,no,none
e184bf1e-4e32-498d-86dc-126ecbece25c,Robin Wittwer,https://play-lh.googleusercontent.com/a/ACg8ocJwuUGGoaBJPv6y3HTR2KP3UqdAIZajLHj2AOidl1OdJ_wu=mo,"An sich eine gute App, leider kann man die Einheiten nicht anpassen. Bei mir wird alles in Amerikanischen Einheiten angezeigt. Etwas nervig. Hoffentlich wird dies bald per Update hinzugefügt. *Update* Nach dem ich den Kundenservice kontaktiert habe und mein Fahrzeug ""digital nach Deutschland geholt wurde"", funktioniert Alles wie es soll. Also wer Probleme mit den Einheiten hat, einfach beim Kundenservice melden.",4,0,1.5.2,2021-09-24 10:33:22,"Hi Robin! Danke für Dein Feedback! Die Einheiten basieren auf den Einstellungen Deines Accounts und es gibt derzeit keine Möglichkeit, die Einheiteneinstellungen zu ändern. Kontaktiere die BMW ConnectedDrive Kundenbetreuung unter +49 89 1250 16010, damit wir Deine Accounteinstellungen überprüfen können. - My BMW App Support Team
",2021-09-07 15:28:58,1.5.2,German,"""Overall a good app, unfortunately you can’t adjust the units. Everything is displayed in American units for me. A bit annoying. Hopefully this will be added via an update soon. *Update* After I contacted customer service and my vehicle was “digitally imported to Germany,” everything works as it should. So anyone having issues with the units, just report it to customer service.""",positive,"localization & language, customer support, vehicle status",unclear,unclear,casual_user,yes,yes,none
ec59aac6-4824-47bb-890e-5699347626e4,AndiMeggs,https://play-lh.googleusercontent.com/a-/ALV-UjVfiCaC-JrZSaZTvWdZteYCVZUtAHRm89gJ4k7pLgWY-GE8o3cO,"Fahrzeugdaten aktualisieren nicht. Seit mehreren Wochen sind meine Daten zum Fahrzeug, also Standort, Tank, km-stand und alles einfach eingefroren. Selbst löschen und neues hinzufügen des Fahrzeug haben keinen Erfolg gebracht..",1,1,1.6.0,2021-09-24 07:30:55,"Hi Andi! Wir bedauern, dass Du diese Probleme mit der My BMW App hast. Kontaktiere die BMW ConnectedDrive Kundenbetreuung, damit wir Dir weiterhelfen können. Du erreichst uns unter +49 89 1250 16010. - My BMW App Support Team
",2021-09-28 10:54:47,1.6.0,German,"""Vehicle data isn't updating. For several weeks now, my vehicle data – location, fuel level, mileage, and everything – is simply frozen. Even deleting and re-adding the vehicle hasn't helped.""",negative,"vehicle status, connectivity, performance",combustion,experienced_user,casual_user,yes,no,none
962b80ac-5a63-4b65-98d0-91bdde3acea0,goettervater76,https://play-lh.googleusercontent.com/a/ACg8ocINrQS3pA3mJz72lIn7Is3ZRGxo9LoHceof8UeeSRYV2Kn4Ww=mo,Finde die App ganz gut. Die Funktion die lade historie zu exportieren ist sehr nützlich. Hoffe man kann in der App auch noch die Verbrauchswerte wie im Fahrzeug abrufen. Wäre für mich ein sinnvolles Feature. Bin guter Dinge das es besser wird.,4,6,1.6.2,2021-09-24 01:29:05,"Hi! Danke für Dein Feedback! Wir bedauern, dass Du aktuell Probleme mit den BMW Points in der My BMW App hast. Das Problem ist uns bekannt und unser Entwicklungsteam arbeitet an einer Lösung. - My BMW App Support Team",2021-07-22 17:24:55,1.6.2,German,"""Find the app quite good. The function to export the charging history is very useful. I hope it will also be possible to retrieve consumption values in the app, as in the vehicle. That would be a meaningful feature for me. I'm optimistic that it will get better.""",positive,"charging management, vehicle status, usage statistics, ev-specific features",ev_hybrid,experienced_user,power_user,yes,yes,none
66512624-cc66-4f93-83a1-bb82b92fff57,Jan R,https://play-lh.googleusercontent.com/a-/ALV-UjVZN9nmN-WFc5sqyIihMSdy1tFNIaRVjZ6MIToV_tN5WDQJYCRg5Q,"Kein remote Service möglich. App verbunden, aber uralter Fahrzeugstandort, keine Standheizung steuerbar, etc. Aber Datum+Uhrzeit und die Info über zukünftige Werkstattbesuche passen. 2 Mal app deinstalliert, Handy (S10) Neustart, Bluetooth im 540i (Baujahr 01.2020) getrennt und neu verbunden. UNFASSBAR. Vor allem da die vorherige app einwandfrei alle Funktionen lieferte. Auf meine Mail an BMW kam eine vertröstende Standardmail.",1,4,1.6.0,2021-09-22 23:56:09,,,1.6.0,German,"No remote service possible. App connected, but shows an outdated vehicle location, heating cannot be controlled, etc. But the date & time and the info about future workshop visits are correct. Uninstalled the app 2 times, restarted my phone (S10), disconnected and reconnected Bluetooth in the 540i (manufacture date 01.2020). UNBELIEVABLE. Especially since the previous app flawlessly provided all functions. I received a deferring standard email in response to my email to BMW.",negative,"connectivity, vehicle status, remote controls, customer support, bmw connected ecosystem",combustion,experienced_user,power_user,yes,no,none
2232e856-6cf2-44b6-a8f8-83128a3e2cbb,JG,https://play-lh.googleusercontent.com/a/ACg8ocIz2uTrmrcHeae1phzJNzZbWjCL0ymEmiZgU-xumy77NVxRyA=mo,Warum werde ich ständig aus der App ausgeloggt? Total nervig,2,1,1.6.2,2021-09-22 23:03:31,"Hi Johannes! Wir bedauern, dass Du derzeit Probleme mit dem schnellen Öffnen der My BMW App über Face ID, Touch ID oder PIN hast! Unser Entwicklungsteam arbeitet an einer Lösung. - My BMW App Support Team
",2021-10-04 21:32:43,1.6.2,German,Why am I constantly being logged out of the app? Totally annoying.,negative,"authentication, performance",unclear,unclear,casual_user,yes,no,none
83227c33-82e0-4e0b-a83d-222411ac9d8f,Maurizio Villano,https://play-lh.googleusercontent.com/a/ACg8ocJj4EF5LprF8sBqFSgcVmQ0CGkIaRFfNiafWphLaD0iMVfwdw=mo,"Katastrophe. Die App aktualisiert sich selten bis garnicht. Weder Tankinhalt, oder Standort noch sonstiges funktioniert einwandfrei. Ein großer Rückschritt zum Vergleich der alten BMW App. Wenn sich nicht sehr bald was ändert knd diese App nicht ordentlich funktioniert, werde ist sie deinstallieren. Schade",1,7,1.6.2,2021-09-22 20:55:40,,,1.6.2,German,"Disaster. The app rarely updates at all. Neither the fuel level, nor location, nor anything else works flawlessly. A major step backward compared to the old BMW app. If things don’t change very soon, if the app can’t function properly, I’m going to uninstall it. Shame.",negative,"vehicle status, performance, updates",combustion,experienced_user,casual_user,yes,no,none
2ac47368-32f4-4983-927c-b2c25b7f0fb7,F P,https://play-lh.googleusercontent.com/a/ACg8ocJIGK1-afIRBpaKgZk82qOI5jOkceh_3KtaTpYtz6UD5RkahQ=mo,Nach Update kommt Meldung Daten eingeben bzw. es kommt eine Fehlermeldung keine Verbindung. Bei Tesla hatte ich noch nie derartige Probleme.,1,3,1.6.2,2021-09-22 20:06:44,,,1.6.2,German,"""After the update, I get a message to enter data or I get an error message saying no connection. With Tesla, I never had such problems.""",negative,"performance, connectivity, updates",unclear,unclear,casual_user,yes,no,tesla
f55432df-b30f-4de0-a199-486233d08670,Michael Busch,https://play-lh.googleusercontent.com/a-/ALV-UjXkdTltmfqhEWilT7V8J7BIgw1hIHMTMl8m7BYwVAdV32IUjRVA,"Gute App,viele Anzeigen",5,0,1.6.2,2021-09-22 19:11:41,,,1.6.2,German,"Good app, lots of ads.",neutral,"mobile features, other",unclear,unclear,casual_user,yes,no,none
2b7d3bb9-1915-4016-bc70-2dc67c254e88,30km/h dalgin dalgin läufer,https://play-lh.googleusercontent.com/a-/ALV-UjVlnIdCMGKR2zSx4ystVIhEvCwE2rEB1TTyh2rGHI1jkb8oWNZY,Bis jetzt läuft das gut. Bin zufrieden damit. Hoffentlich wird das auch gut laufen. Sonst ist das zu Latzhose mit Milchhose.,5,0,1.6.0,2021-09-22 19:11:05,,,1.6.0,German,"So far, it's running well. I'm satisfied with it. Hopefully, it will continue to run well. Otherwise, it's a real mess.",neutral,performance,unclear,unclear,casual_user,yes,no,none
8f982d4c-74b6-4ca0-8527-aa6f9cbbf1ab,Adrian Semmler,https://play-lh.googleusercontent.com/a-/ALV-UjVYt00KfIPEwjS-VcTLilFsFtReG4OSbKAJLQgKQEdnbgCIuJzl,Nach dem Update geht die Aktualisierung der Autodaten wieder,4,0,1.6.2,2021-09-22 18:24:23,,,1.6.2,German,"After the update, the car data synchronization is working again.",positive,"vehicle status, connectivity, updates",unclear,experienced_user,casual_user,yes,no,none
59bd30f8-cdcc-4aed-80a1-e1f7970f3bc3,Alex Heil F.,https://play-lh.googleusercontent.com/a-/ALV-UjXhrNfw6HExxC1tP7Oj33D-FkkpQU8-8CzOnq1m_b27NGKloHLc,"Die App ist immer noch eine Tragödie! Nun entdecke ich, dass Rufnummern ""aus den Favoriten (z.B. eine BMW-Filialle) weder mit einem ""+"" noch mit ""00"" der Telefon-App weitergereicht wird. Nur mit ""49 89 ..."" kann das arme Telefon NICHTS Anfangen. ... Ein Stern dazu, da ich gemerkt habe, dass Paar Mankos behoben wurden. Weiter so! ... Des Weiteren, schön eine dauerhafte Benachrichtigung zu haben. Nun aber, sie hätte eine mindest. eine Funktion haben können, und zwar ""die App selbst aufzurufen"".",3,8,1.6.0,2021-09-22 16:25:28,"Hi Alexandre! Danke für Dein Feedback! Ein Fahrzeug kann immer nur mit einer BMW ID verbunden sein. Aber mehrere Personen können die My BMW App auf unterschiedlichen Smartphones mit demselben Konto nutzen. - My BMW App Support Team
",2021-07-09 10:55:31,1.6.0,German,"The app is still a tragedy! Now I discover that phone numbers ""from favorites (e.g., a BMW dealership) aren’t passed on to the phone app with either a ""+"" or ""00"". The poor phone can’t do anything with ""49 89 ..."". One star added because I noticed that a few shortcomings have been fixed. Keep it up! … Furthermore, it’s nice to have a persistent notification. But now, it could at least have a function to open the app itself.",negative,"connectivity, mobile features, notification management",unclear,experienced_user,power_user,yes,yes,bmw
2f5a94c5-f03b-4a79-83ef-2a524d94b4a9,Mi Vo,https://play-lh.googleusercontent.com/a/ACg8ocI2619VbH3DUR1wrZtbuqqJUcEtEh0ifjgGhSsPFCKM3yTglw=mo,Schneller Bugfix. Die Kommunikation mit dem Fahrzeug funktioniert wieder. Danke!,5,1,1.6.2,2021-09-22 12:48:19,,,1.6.2,German,"""Quick bug fix. Communication with the vehicle works again. Thanks!""",positive,"performance, connectivity",unclear,unclear,casual_user,yes,no,none
80bedbe1-c02d-4800-98c3-a789d4c66e64,Dietmar S.,https://play-lh.googleusercontent.com/a/ACg8ocJ1Zi7kJkUkeK_GiHyc8KWuGLPc55VuSGR5TNvK0BwH_TCHcA=mo,Häufige Ausfälle Connected Drive,2,1,1.6.0,2021-09-22 10:33:16,,,1.6.0,German,Frequent Connected Drive outages,negative,connectivity,unclear,unclear,unclear,yes,no,none
53df0bf7-1ba7-4151-9ceb-30c6129b7e04,Mehmet Ince,https://play-lh.googleusercontent.com/a/ACg8ocIs-fxoyMxtYZGvKuDoDBqf4xU_UhIWtSATOvJG2fzf54QUcA=mo,Beste App für BMW! Bin von Kack Audi gewechselt auf BMW und habe es nicht bereut.,5,0,1.6.0,2021-09-22 06:53:46,,,1.6.0,German,"Best app for BMW! Traded in my Audi – ""kack Audi"" – for a BMW and have no regrets.",positive,bmw connected ecosystem,unclear,unclear,casual_user,no,no,audi
54b1e425-a2f6-44f4-a27b-3dba3445fdc8,V.S.,https://play-lh.googleusercontent.com/a/ACg8ocL4a0xmi74LeKnM4mSlEbCW9wPxtSLpr9GZ1ZaFzOOprV-Prw=mo,"Was ist denn los??? Seit 18.9. passiert nix in der App. Ständig steht ist was schief gelaufen. Also bitte, beseitigt den Fehler nach dem Update !!!! DANKE",1,2,1.6.0,2021-09-21 19:04:55,,,1.6.0,German,"What's going on??? Nothing has happened in the app since 09/18. Constantly it says something went wrong. So please, fix the error after the update!!!! THANK YOU",negative,"performance, updates",unclear,experienced_user,unclear,yes,no,none
c63955fd-7068-4b36-a461-bae4291d87df,Markus Renner,https://play-lh.googleusercontent.com/a-/ALV-UjU8VGQw6albQ2qfIihv4_CAgnhDA-32qkGYdcN3m1LVWx5h_Zhvdw,"Update: die App ist jetzt im schwarzen Design, schaut besser aus, aber ich werde jeden Tag sporadisch ausgeloggt und muss jedes Mal eine neue Pin vergeben. Ist das normal? Es ist immer noch erstaunlich, dass die App so wenige Funktionen bietet im Verhältnis zum Fahrzeug und dessen Ausstattung, sowie dessen Preis. Warum keine Verbrauchswerte zu sehen sind? Eigentlich eine heutzutage essentielle Funktion. Temperatur der Standheizung einstellen geht geht auch nicht. Hier ist doch ganz viel Luft.",2,17,1.6.0,2021-09-21 18:39:09,"Hi! Danke für Dein Feedback! Mit der Version 2.9.0 der My BMW App ist nun für Fahrzeuge mit OS7 und neuer die „Meine Fahrten“ Funktion verfügbar, mit der Du Informationen über Deine letzten Fahrten erhältst, inklusive Fahrtstatistiken zu Durchschnittsgeschwindigkeit, Dauer und Kraftstoffverbrauch. – My BMW App Support Team",2022-09-13 13:50:04,1.6.0,German,"Update: the app is now in dark design, looks better, but I’m sporadically logged out every day and have to enter a new PIN each time. Is that normal? It’s still astonishing that the app offers so few functions in relation to the vehicle and its equipment, as well as its price. Why are consumption values not visible? Actually an essential function nowadays. Adjusting the standby heater temperature doesn's work either. There's a lot of room for improvement here.",negative,"ui/ux, authentication, vehicle status, remote controls",unclear,experienced_user,casual_user,yes,yes,none
1156c016-41c5-49ba-9939-25589b5017da,Robert Hochstrasser,https://play-lh.googleusercontent.com/a/ACg8ocKXDfMuWwsSDed4ZlyZN_5kIfDpvAGIQt43sBjOJ2PET0jMkQ=mo,Für einen Premium Anbieter eine extrem schlechte App. Nicht zu empfehlen.,1,1,1.6.0,2021-09-21 18:30:00,,,1.6.0,German,"For a premium provider, this is an extremely bad app. Not recommended.",negative,"ui/ux, performance",unclear,unclear,unclear,yes,no,none
f3391c7c-d4f3-4158-84d0-5f7c429eff04,Benjamin Lo.,https://play-lh.googleusercontent.com/a-/ALV-UjWk7G_twmEYCTZp0qtXOOmpl94muoWDtDRsyV7M9uhydvvOo-3L,"Absolut verschlimmert. Ständig sind Services nicht verfügbar, die Ortung und Aktualisierung funktioniert so gut wie gar nicht mehr. Sehr enttäuschend..",2,3,1.6.0,2021-09-21 16:25:57,,,1.6.0,German,"Absolutely getting worse. Services are constantly unavailable, the location and updating barely work anymore. Very disappointing.",negative,"performance, vehicle status, connectivity",unclear,experienced_user,casual_user,yes,no,none
