reviewId,userName,userImage,content,score,thumbsUpCount,reviewCreatedVersion,at,replyContent,repliedAt,appVersion,language,content_english,sentiment,topics,vehicle_type,user_experience,usage_profile,is_pain_point,is_feature_request,competitor_mentioned
f6afd33e-794a-485f-8597-61bd26bf159c,Dieter Burggraf,https://play-lh.googleusercontent.com/a/ACg8ocIYH14qP2-Xq4lM-AOeIuaxFtg8e1fndk4ru9Y_9AxzeO3gmg=mo,Wieso muss man eigentlich einen Stern mindesten vergeben? Ich habe es schon einmal hier bemängelt: Wieso kann ich meine Klimatisierung zu einer bestimmten Abfahrtszeit nicht herausnehmen? Und warum muss ich umständlich eine Zeit eingeben? Diese App ist BMW nicht würdig.!!!!! Die alte App hat zuverlässig gearbeitet. Hier konnte man sagen: Jetzt klimatisierten. Screenshots von meinem Problem stelle ich gerne zur Verfügung.,1,3,1.7.0,2021-11-12 19:06:35,"Hi Dieter! Danke für Dein Feedback! Kontaktiere die BMW ConnectedDrive Kundenbetreuung, damit wir Dir weiterhelfen können. Du erreichst uns unter +49 89 1250 16010. Stelle sicher, dass Du die Einstellungen für die Abfahrtszeiten in Deinem Fahrzeug mit “AN DAS FAHRZEUG SENDEN” aktivierst. - My BMW App Support Team
",2021-11-18 14:42:45,1.7.0,German,"Why does one even have to give a minimum of one star? I’ve already complained about this here: Why can’t I remove the climate control scheduling for a specific departure time? And why do I have to enter the time in a cumbersome way? This app isn’t worthy of BMW.!!!!! The old app worked reliably. Here, you could say: Now climate control. I’m happy to provide screenshots of my problem.",negative,"ui/ux, remote controls, trip planning",unclear,experienced_user,power_user,yes,yes,none
abfcf8ac-7d4f-4128-bb73-86e62c01350f,Ike Oehn,https://play-lh.googleusercontent.com/a/ACg8ocIQrbcxNffW35J4WklBe0kSaOLhm-MIYpRI7s0PNMpyA_FYsg=mo,"Haben oder nicht - ganz klar, haben! Praktisch mit nachschauen können, ob das Auto abgeschlossen ist oder nicht usw. Und jetzt wohl auch kostenlos, auch für mehr als 3 jahre ältere Autos.",5,0,1.7.0,2021-11-12 18:24:09,,,1.7.0,German,"Have it or not - clearly, have it! It’s practical to be able to check whether the car is locked or not, etc. And now apparently also free, even for cars older than 3 years.",positive,"vehicle status, remote controls, bmw connected ecosystem",unclear,unclear,casual_user,no,no,none
94fc8ff0-6e16-4540-9637-1bcaa5d29439,B. ***,https://play-lh.googleusercontent.com/a-/ALV-UjUmlivU4vJuGcMa5Ia8F1dwh4m5no3sJuwtNec7keIYDVTmwfRZQw,Connected konnte schon mehr. Ich möchte die App nicht missen. Von Bedienung bis Status wichtige drahtlose Zugriffmöglichkeit auf meinen Wagen.,4,0,1.7.0,2021-11-12 16:52:43,,,1.7.0,German,"Connected could do more. I wouldn't want to miss this app. From operation to status, important wireless access to my car.",neutral,"connectivity, vehicle status",unclear,unclear,casual_user,yes,yes,none
a4526df4-5d18-4225-adb2-1c16e99bfa79,Bişey Söylicem,https://play-lh.googleusercontent.com/a-/ALV-UjWfDaWrv7hjQH2loqFJHDM1BC9LtK6wYnpsRs1dpSrgH4la85Es,tolle app,5,0,1.7.0,2021-11-12 16:30:30,,,1.7.0,German,"""great app""",positive,other,unclear,unclear,unclear,no,no,none
7e2f5e35-13e8-4c89-8f8b-d2cfe453d219,Viktor Dorn,https://play-lh.googleusercontent.com/a/ACg8ocL_3f3_QtUaKj_IbGI-67pj-RxCdbTZ7_9naQyBjBvIBPS6Lw=mo,passt,5,0,1.7.0,2021-11-12 12:53:54,,,1.7.0,German,"""passt""",neutral,other,unclear,unclear,unclear,no,no,none
6f66382c-58d0-4131-adde-c123a9fe912a,Friedhelm Hannemann,https://play-lh.googleusercontent.com/a/ACg8ocI-6M2RcccMxfTlR4Co8jJohRQg5XSQUMu35vpR3K2lEaX1HQ=mo,Die funktioniert häufig fehlerhaft. Sie lässt sich erst nach erneuter Eingabe aller Daten öffnen. Nach Behebung dieser Fehler wäre die App gut,3,0,1.6.2,2021-11-12 12:20:50,"Hi Friedhelm! Danke für Dein Feedback! Wir bedauern, dass Du derzeit Probleme mit dem schnellen Öffnen der My BMW App über Face ID, Touch ID oder PIN hast! Unser Entwicklungsteam arbeitet an einer Lösung. - My BMW App Support Team
",2021-11-15 18:50:59,1.6.2,German,"It frequently malfunctions. It only opens after re-entering all the data. After resolving these errors, the app would be good.",negative,"performance, ui/ux",unclear,unclear,casual_user,yes,no,none
2db81f79-6345-477d-a8f2-eb05b344ea9e,To Bo,https://play-lh.googleusercontent.com/a-/ALV-UjUR7Adz1Jku9REovpKSeatskJSJS7ALuU_aU4LWsB2-FqpxXpVF,Die App hängt sich öfters auf und zeigt keine Ladezustand an.,3,0,1.7.0,2021-11-12 12:20:49,,,1.7.0,German,The app freezes up frequently and doesn't display the charging status.,negative,"performance, vehicle status, charging management",ev_hybrid,unclear,casual_user,yes,no,none
909769ee-fa5a-4cd6-a1ed-8fbaaecee257,revilO hcsaP,https://play-lh.googleusercontent.com/a-/ALV-UjW9X5fE7wCa7jugJAJPEec-QW9a8nMZ8dk290EbZwXNglHKlBdexQ,"Minimale Funktionalität, permanent sind die AGB zu bestätigen. Ganz ehrlich, diese App braucht man nicht.",2,0,1.6.2,2021-11-12 11:38:26,,,1.6.2,German,"Minimal functionality, you constantly have to confirm the terms and conditions. Honestly, you don't need this app.",negative,"ui/ux, mobile features",unclear,unclear,casual_user,yes,no,none
fb5ae998-c021-454f-98e1-21bc548da8aa,David Hanschke,https://play-lh.googleusercontent.com/a/ACg8ocKCicfc9GWiEPzA-5TdDA948Paip167Obb2BfjEAoSQsi2M-ffE=mo,"Die App wird kontinuierlich weiterentwickelt und man erhält auch für ein mittlerweile 4 Jahr altes Fahrzeug neue Features! Das finde ich als BMW-Fahrer einfach nur geil! :-) ..well done! Funktionieren tut sie übrigens gut, hatte nur selten Probleme. Die App ist definitiv ein starkes Argument wieder einen BMW zu erwerben!",5,0,1.7.0,2021-11-12 11:19:17,,,1.7.0,German,"The app is continuously being developed and you get new features even for a vehicle that's now 4 years old! As a BMW driver, I just think that’s awesome! :-) ..well done! It functions well, I've rarely had any problems. The app is definitely a strong argument for buying another BMW!",positive,"updates, performance, bmw connected ecosystem",unclear,experienced_user,casual_user,no,no,none
bac4ba91-f8ee-4a8d-bf8a-53928a940fed,Agge Maier,https://play-lh.googleusercontent.com/a/ACg8ocINC2aC8pRM6h7qdFNWwUddAq1FYU34_Vz09eg50Yov-IzBAw=mo,Nützlich,5,0,1.6.2,2021-11-12 11:12:55,,,1.6.2,German,"""Useful""",positive,other,unclear,unclear,unclear,no,no,none
c91cf0d7-1a2d-4bd6-b8e2-0d1521b0c239,Thomas,https://play-lh.googleusercontent.com/a/ACg8ocJB-SQQcTY3K4GmDQgqpLb4SP6Nmv65wUC64tuVCeJmj0Op10E=mo,Top,5,0,1.7.0,2021-11-12 10:07:17,,,1.7.0,German,"""Top""",positive,other,unclear,unclear,unclear,no,no,none
49a72130-8067-4b6b-a826-3dc322373c26,Philipp Burckhardt,https://play-lh.googleusercontent.com/a-/ALV-UjVP4uBqNwPjydlhARV8BHE5C7Qb5rhY03KnBKQew1rCDlqdXlMVrw,top,5,1,,2021-11-12 08:09:12,,,,German,"""top""",positive,other,unclear,unclear,unclear,no,no,none
2706b435-63e8-459a-87f6-9a9c49253f87,Horst Dejon,https://play-lh.googleusercontent.com/a/ACg8ocLBj_yyPjaiKqGUAxKneFiEXvyONvdL4CMRxN8HbSDAXmQI1A=mo,Ich empfinde die App als sehr praktisch bei der Nutzung eines E-Fahrzeuges,5,0,1.7.0,2021-11-12 07:34:02,,,1.7.0,German,"""I find the app very practical when using an electric vehicle.""",positive,"ev-specific features, vehicle status",ev_hybrid,unclear,casual_user,no,no,none
f717c71d-d1bc-417e-9824-489d03490f77,g8043em,https://play-lh.googleusercontent.com/a-/ALV-UjU0IM75hPGy8BmNA1clXdy9POmXppoABa64Ild69xl0xUrGXOK4OQ,Katastrophale User Exoerience in Verbindung mit Update BMW Connected Drive!!!,1,1,1.7.0,2021-11-11 22:54:50,,,1.7.0,German,"""Catastrophic user experience in conjunction with the BMW Connected Drive update!!!""",negative,"ui/ux, performance, updates",unclear,experienced_user,unclear,yes,no,none
5dadb223-8716-44bb-9e92-ab16a7f6bf63,Hans-Jürgen Scheele,https://play-lh.googleusercontent.com/a-/ALV-UjWd_WftTVZ2RddISlHxNkDop9ZgbSyck7q9tAWFymHoec_JdfYq,Laufend müssen nochmals korrigierte Nutzungsbedingungen akzeptiert werden. Das nervt und lässt die eigentlich guten Funktionen in den Hintergrund treten.,1,1,1.6.2,2021-11-11 22:14:48,,,1.6.2,German,"""You constantly have to accept revised terms of use again. This is annoying and lets the actually good functions fade into the background.""",negative,"ui/ux, updates",unclear,experienced_user,casual_user,yes,yes,none
c800ab42-d9d9-4a14-9581-edb8bc41a3f3,Guenter S,https://play-lh.googleusercontent.com/a-/ALV-UjUc52cTCQND8r4gYoEFeri3HyJbPLzp2yIxGu3Z_lXtKazAq807,Habe die App seit Monaten mit meinem BMW verbunden. Was BMW leider nicht daran hindert alle paar Tage neue Erinnerungen ans Auto zu schicken man sollte doch bitte die App installieren. Viel kundenunfreundlichee geht es kaum.,1,2,1.7.0,2021-11-11 18:53:28,,,1.7.0,German,"""I've had the app connected to my BMW for months. Which doesn't stop BMW from sending new reminders every few days that I should please install the app. You can hardly get more customer-unfriendly than this.""",negative,bmw connected ecosystem,unclear,experienced_user,casual_user,yes,no,none
625cf252-5b84-489c-b4a2-57d81c512953,Andiana McBiber,https://play-lh.googleusercontent.com/a/ACg8ocIcQwuluUqRCFtXqp10511kfT4FDtcJsWk1sL0w3HW6riYHuQ=mo,"Naja, Begeisterung löst es nicht aus. Beispiel: Fenster wird als offen angezeigt. Kann man es schließen? Nein, also ich raus, es regnet, Fenster ist zu, ich bin aber nass. App zeigt es immer noch als offen an. Was kann die App sonst noch? Tankfüllstand und Reichweite, Gebläse einschalten, auf- und abschließen, geschlossene Fenster als offen anzeigen, Kilometerstand, nächster Service, hupen, blinken, Ort anzeigen. Es kann nicht: Sitzheizung ein, Fenster schließen, Fenster + Kofferraum öffnen",2,18,1.7.0,2021-11-11 17:03:00,,,1.7.0,German,"Well, it doesn't exactly inspire enthusiasm. For example: the window is displayed as open. Can you close it? No, so I get out, it's raining, the window is closed, but I'm wet. The app still shows it as open. What else can the app do? Fuel level and range, turn on the blower, lock and unlock, display closed windows as open, mileage, next service, honk, flash lights, show location. It can't: turn on seat heating, close windows, open windows + trunk.",negative,"ui/ux, vehicle status, remote controls",combustion,experienced_user,casual_user,yes,yes,none
d702a437-39c2-4cd7-89bf-92a2e4e8f02b,Werner Meyer,https://play-lh.googleusercontent.com/a/ACg8ocL_0SELbK0IlkDuBFcNEd1XuHKEuJPmu-OGtWovPneGZeG6=mo,"Mit der Connected App konnte ich ohne Probleme den aktuellen Reifendruck sehen. Dann kam das Downgrade auf My BMW. Trotz aktueller Ankündigung funktioniert das noch immer nicht. Nach einem halben Jahr als Besitzer eines gut einem Jahr alten BMW muss ich leider sagen, dass die Onlinedienste von BMW ganz weit hinter denen anderer Marken zurück liegt, und das nicht nur wegen der fehlenden Anzeige des Reifendrucks.",2,22,1.7.0,2021-11-11 16:51:01,,,1.7.0,German,"“With the Connected App, I was able to see the current tire pressure without any problems. Then came the downgrade to My BMW. Despite the current announcement, it still doesn't work. After half a year as the owner of a BMW that’s a little over a year old, I unfortunately have to say that BMW's online services are lagging far behind those of other brands, and not just because of the missing tire pressure display.”",negative,"vehicle status, connectivity, updates, bmw connected ecosystem",unclear,experienced_user,casual_user,yes,yes,other brands
aafb8c43-5ae3-4c93-95a8-127222bcad1e,Ma Rio,https://play-lh.googleusercontent.com/a-/ALV-UjWazRuI-Ux2MxAlVtGIIhmW4nrCC1WqzvY_5gNsRxpS-dgl7Q_h,"App ist auch nach dem heutigen Update auf 1.7.0 nicht mehr nutzbar, da sämtliche Remote-Funktionen einschließlich Statusabfrage ausfallen. Status weiterhin auf 04.11.2021 eingefroren!!!! Desolat und enttäuschend!!!!",1,2,1.7.0,2021-11-11 16:44:00,,,1.7.0,German,"""App is also unusable after today's update to 1.7.0, as all Remote functions, including status queries, fail. Status still frozen on 04.11.2021!!!! Desolate and disappointing!!!!""",negative,"performance, connectivity, vehicle status, remote controls, updates",unclear,experienced_user,power_user,yes,no,none
10fbb1de-115b-4fd0-8e6d-e1fdbe55ec1a,Tugay Ak,https://play-lh.googleusercontent.com/a/ACg8ocKKR6mngaC9sVY7u4NlfQ3WG5Wn8O7muBDEKU75jJ0l3gD0ZA=mo,Mittlerweile funktioniert die App ganz gut. Nur nervig dass man sporadisch die Nutzungsbedingungen nochmals bestätigen muss oder neu einloggen,4,1,1.6.2,2021-11-11 16:24:34,"Hi Tugay! Danke für Dein Feedback! Wir bedauern, dass Du derzeit Probleme mit dem schnellen Öffnen der My BMW App über Face ID, Touch ID oder PIN hast! Unser Entwicklungsteam arbeitet an einer Lösung. - My BMW App Support Team
",2021-11-15 18:52:23,1.6.2,German,"""The app works quite well now. It's just annoying that you occasionally have to re-confirm the terms of use or log in again.""",positive,"authentication, performance",unclear,experienced_user,casual_user,yes,no,none
e248e87d-f066-4a8a-9cd8-5a9993728fa2,M S,https://play-lh.googleusercontent.com/a/ACg8ocJ7ThsbtvgShQAN302bGBnTpw6XeQslR4wpxsxTYm-zmPUjzIRZ=mo,Soweit alles gut macht was es soll,5,0,1.6.2,2021-11-11 16:18:36,,,1.6.2,German,"So far, does what it's supposed to do.",neutral,vehicle status,unclear,unclear,casual_user,no,no,none
8e5d37b9-d833-4821-ba82-d9b179535fcf,Ich bins,https://play-lh.googleusercontent.com/a-/ALV-UjWmJxKCMgVqhfoPZoY0b8GuVjpQqZAa_SmL9h0EpEd1Lqp2g3Ea,Endlich ist nach einigen Updates alles in Ordnung. Wo finde ich die Anzeige für den Reifendruck?,5,7,1.7.0,2021-11-11 16:05:50,Hi! Danke für Dein Feedback! Ein Klimatimer für BMW Fahrzeuge mit Verbrennungsmotor sowie weitere Features folgen in künftigen Releases der My BMW App. Wir informieren über neue Funktionen immer in den App Release Notes. - My BMW App Support Team,2020-12-02 17:21:05,1.7.0,German,"Finally, everything is working correctly after several updates. Where can I find the tire pressure display?",positive,"performance, vehicle status, ui/ux",unclear,experienced_user,casual_user,yes,yes,none
61d146a1-17a8-4ddb-a75e-1053a1b36492,B. J. Schmidt,https://play-lh.googleusercontent.com/a-/ALV-UjVauL9WRl6SJ97BisijgxSOewQut_UFy03mNQwwg0v7qjuQ4fE,"..ich bin ja so richtig enttäuscht! Da fahre ich ein Auto das über 100.000 Euro kostet. Und eine App wird angeboten, die nur Probleme macht. Wenn ich den Standort abfragen muss, weil ein zweiter Fahrer es wo auch immer geparkt hat, funktioniert die Suche nicht. Was ist los mit euren Programieren? Andere Automarken können das doch auch! Was gedenkt ihr zu tun, dass ihr mal wieder zufriedene Kunden habt? Es stehen doch nur negative Bewertungen im Netz. Tut bitte mal was, dass dauerhaft funktionie!",1,9,1.6.2,2021-11-10 18:24:59,,,1.6.2,German,"""I'm really disappointed! I drive a car that costs over €100,000. And an app is offered that just causes problems. When I need to query the location because a second driver parked it somewhere, the search doesn’t work. What's going on with your programmers? Other brands can do it too! What do you intend to do to have satisfied customers again? There are only negative reviews online. Please do something that works reliably!""",negative,"vehicle status, connectivity, performance, customer support",unclear,experienced_user,casual_user,yes,yes,none
f1e08dc8-b237-4b04-a18d-3e2cb6d66b01,Chris Hill,https://play-lh.googleusercontent.com/a-/ALV-UjXuJs1IrAutxLX6Z4WmbvMzzBd4PJchSVA9sCb7MQIxPx2X3ng,wird immer besser,5,0,1.6.2,2021-11-10 09:00:12,,,1.6.2,German,"""getting better and better""",positive,"updates, performance",unclear,unclear,unclear,no,no,none
a1576935-f9f1-4e79-84c1-29bcf2aca0e8,Werner Hess,https://play-lh.googleusercontent.com/a/ACg8ocKnQJGIS9O_rn-7Pgn-DSUvNFonUXL_WrmnS18t-aiuPFROUg=mo,Passt für meine Anfordeeungen,5,0,1.6.2,2021-11-10 06:36:24,,,1.6.2,German,"""Fits my requirements.""",neutral,other,unclear,unclear,casual_user,no,no,none
9678ff75-9821-4b9f-986d-a572642d2cf0,Salman Polat,https://play-lh.googleusercontent.com/a/ACg8ocLvYdlKCSa7-f-UQm8OIiODOzhhnhOH7ogQb_gZpduzCCnNsA=mo,Sehr schön,5,0,1.6.2,2021-11-10 01:49:56,,,1.6.2,German,Very nice.,positive,other,unclear,unclear,unclear,no,no,none
38c91475-ef99-4b3a-967a-a47c11bd43f1,Manfred Elmer,https://play-lh.googleusercontent.com/a/ACg8ocJ-w6hRB6Cs6uuiSgBIKECNXwyOFmmxpJ9XYLLXmiNI0Da_Qg=mo,Die App ist sehr gut gelungen!,5,0,1.6.2,2021-11-09 20:41:35,,,1.6.2,German,“The app is very well done!”,positive,ui/ux,unclear,unclear,unclear,no,no,none
49c6ca5a-3434-4370-bf04-9c36fd3c8edd,Michael Wagner,https://play-lh.googleusercontent.com/a/ACg8ocL2h3xE_3G1rff5wN7XpVDzJ7kOjZWWGdNzwuTFu9OCw2E6Yw=mo,"Mich hat ja schon der Wechsel von Connected App zu my BMW App genervt, da konnte ich immer sehen wie viel ich elektrisch gefahren bin. Aber seit kurzem das ständige anmelden stört mich total.",1,1,1.6.2,2021-11-09 19:48:39,"Hi Michael! Wir bedauern, dass Du derzeit Probleme mit dem schnellen Öffnen der My BMW App über Face ID, Touch ID oder PIN hast! Unser Entwicklungsteam arbeitet an einer Lösung. Weitere Funktionen, inkl. der Anzeige der elektrisch gefahrenen Kilometer in der My BMW App, folgen in künftigen Releases der My BMW App. - My BMW App Support Team
",2021-11-12 14:27:45,1.6.2,German,"“I was already annoyed by the switch from the Connected App to the My BMW App, because I could always see how much I’d driven electrically. But recently, the constant re-login is really bothering me.”",negative,"authentication, ev-specific features, usage statistics",ev_hybrid,experienced_user,power_user,yes,no,none
6951b60a-b327-47bf-ba94-a3fd2a10a3b7,Benny Siracusa,https://play-lh.googleusercontent.com/a/ACg8ocKS91un2tSHuGWqv3n50ialcgdbrVthouyy9tjYpP6h334RFA=mo,Ein ehr zuverlassige APP,5,0,1.6.2,2021-11-09 15:48:13,,,1.6.2,German,"""An honestly more reliable app.""",positive,performance,unclear,experienced_user,casual_user,yes,no,none
b9324224-ed8b-4fcf-a3af-e60f6ec643a9,Christian Heckel,https://play-lh.googleusercontent.com/a/ACg8ocJDQqy_-E6cXeqy1dVhWW7SrOuaPQ8IvT6aIBcFcpfGsXZAsQ=mo,"Warum muss ich nach jedem Update die Zuganagsdaten neu eingeben, dass Problem hatte die Vorgängerapp auch schon und sollte endlich mal behoben werden.",1,1,1.6.2,2021-11-09 11:23:27,,,1.6.2,German,"“Why do I have to re-enter my login details after every update? The previous app had this problem too, and it really needs to be fixed once and for all.”",negative,"authentication, updates",unclear,experienced_user,casual_user,yes,yes,none
4ab6049f-ce44-48ca-8f90-7620307acf07,Mario Mey,https://play-lh.googleusercontent.com/a/ACg8ocI3cpAHOnedMeueuLBPFjDy6CmJHOxhhLxCGaGGhSJtiBA7Kg=mo,Funktioniert nicht,1,0,1.6.2,2021-11-09 08:58:35,,,1.6.2,German,"""Doesn't work.""",negative,performance,unclear,unclear,unclear,yes,no,none
bc11105e-cb41-42b1-aacf-1fc1cf01a10d,Simon Wagner,https://play-lh.googleusercontent.com/a/ACg8ocIvQ-uTk04SpbF_ERsmM_lE6W5mvPN1SoOjPbAYv46PqhDGQQ=mo,"Leider funktioniert die App seit Anmeldung auf zwei unterschiedlichen Smartphones iOS und Android nicht. Es kommt immer folgende Infomeldung. ""Daten nicht verfügbar. Es ist derzeit nicht möglich die erforderlichen AGBs abzurufen. Bitte versuchen Sie es später erneut."" Der darunter befindliche ""Erneut versuchen""-Button funktioniert nicht. Das hätte ich von BMW nicht erwartet...",1,5,1.6.2,2021-11-09 08:36:18,"Hi Simon! Danke für Dein Feedback! Wir bedauern, dass Du aktuell Probleme bei der Nutzung der My BMW App hast. Kontaktiere die BMW ConnectedDrive Kundenbetreuung, damit wir Deinen Heimatmarkt und Deine Account Einstellungen prüfen können. Du erreichst uns unter +49 89 1250 16010. - My BMW App Support Team
",2021-11-12 14:27:59,1.6.2,German,"""Unfortunately, the app has been malfunctioning since registration on two different smartphones, iOS and Android. The following information message always appears: ""Data not available. It is currently not possible to retrieve the required Terms and Conditions. Please try again later."" The ""Try again"" button below it doesn't work. That's not what I expected from BMW...""",negative,"performance, connectivity, authentication",unclear,unclear,unclear,yes,no,none
4326f336-3de6-47c8-a629-ee1e3d24869b,Jörg Bretschneider,https://play-lh.googleusercontent.com/a/ACg8ocIj1moYw-Bdx_gWu4PJQUiO4zr-8kMK1-j-IkyO0kyQ8Tn9DQ=mo,"Gerade eben hat die App wieder einmal nicht richtig funktioniert. Ich habe den Akku geladen. Das Fahrzeug war über 3 Stunden an der Wallbox..... Und zum wiederholten Male wurden keine 20 Points gutgeschrieben. Langsam finde ich es ärgerlich, zumal BMW beim Umtausch der Punkte in Ladeguthaben 0.79 € pro kWh verlangt. Das ist ein unverschämt hoher Preis. Dann erwarte ich wenigstens, dass ihr auch die BMW Points korrekt gutschreibt. 😤",2,4,1.6.2,2021-11-08 21:19:10,"Hi Jörg! Wir bedauern, dass du dieses Problem mit der My BMW App hast. Melde uns dieses Problem mit Angabe Deines Store Alias ""Jörg Bretschneider"" und der""ID283468093152"" möglichst detailliert über ""Profil"" > ""Feedback senden"". Unser Entwicklerteam kann anhand der übermittelten Fahrzeugdaten überprüfen wo genau der Fehler liegt. - My BMW App Team
",2021-11-12 14:28:19,1.6.2,German,"Just now the app malfunctioned again. I charged the battery. The vehicle was connected to the wallbox for over 3 hours..... And for the repeated time, less than 20 Points were credited. I’m starting to find it annoying, especially since BMW charges €0.79 per kWh when exchanging Points for charging credit. That’s an outrageously high price. Then I expect you to credit the BMW Points correctly at least. 😤",negative,"performance, charging management, ev-specific features",ev_hybrid,experienced_user,power_user,yes,no,none
5ae67e83-1502-4303-99dc-0581cf64c632,Michael Dorsch,https://play-lh.googleusercontent.com/a/ACg8ocIcVDTxz1oKZgus3MqH-AsVX5BtV-SOCLUWKtmB8j5q7ZvMIA=mo,"App läuft meist nur paar Sekunden, dann Mitteilung, dass App leider beendet wird",3,0,1.6.2,2021-11-08 13:10:15,,,1.6.2,German,"""The app usually runs for only a few seconds, then it displays a message saying the app has unfortunately been terminated.""",negative,performance,unclear,unclear,unclear,yes,no,none
f6ea6f47-ce43-4380-87b0-3f7b8f3c621f,Die Bastelschwaben,https://play-lh.googleusercontent.com/a-/ALV-UjVIsfaI_aR7hqmK0HwralehSTT36pLNk9rS0JkG4yf0UNHHs4cajA,Die App bleibt laufend hängen. Hilft nur noch deinstallieren und neu installieren. Connect war 1000 mal besser,1,1,1.6.2,2021-11-08 12:53:49,,,1.6.2,German,The app keeps freezing constantly. Only uninstalling and reinstalling helps again. Connect was much better.,negative,"performance, connectivity",unclear,experienced_user,casual_user,yes,no,connect
fea7f673-aea9-4a6e-a036-1e3720f50bed,Anton Wagner,https://play-lh.googleusercontent.com/a/ACg8ocKQdqsUx_iHVxQza-e8AiLhPDFPmljJoQuj0iaBQjH8k9HvUw=mo,"Ständig Probleme. Stürzt ab, hängt sich auf, alexa funktioniert ständig nicht und verlangt neueinrichtung was dann nicht geht...",1,1,1.6.2,2021-11-08 08:27:35,,,1.6.2,German,"Constant problems. It crashes, freezes, Alexa constantly doesn't work and demands a re-setup, which then doesn’t work...",negative,"performance, connectivity, voice assistant",unclear,unclear,power_user,yes,no,none
c54f8938-3dff-45e5-8d8f-a85f01322fe7,Anne Richter,https://play-lh.googleusercontent.com/a/ACg8ocKPhcziOT0phC5rxRek0LtRovC7WvgOA82tExOcKTFFx2TL=mo,"Seit dem letzten Update funktioniert die App so gut wie gar nicht mehr. Auch Deinstallation und Neuinstallation bringen nichts. Schade, denn jetzt kann man nicht einmal mehr sehen wann das Fahrzeug voll geladen ist. Traurig, nachdem erzwungenen Wechsel der connected drive App Verbrauchsdaten nicht mehr ersichtlich waren, geht mittlerweile gar nichts mehr. Wir werden das Ganze deinstallieren und bestimmt nicht weiterempfehlen. Für einen Premiumhersteller unwürdig. Gott sei Dank ist der iX3 besser",1,6,1.6.2,2021-11-07 19:37:44,"Hi! Danke für Dein Feedback! Mit der Version 2.9.0 der My BMW App ist nun für Fahrzeuge mit OS7 und neuer die „Meine Fahrten“ Funktion verfügbar, mit der Du Informationen über Deine letzten Fahrten erhältst, inklusive Fahrtstatistiken zu Durchschnittsgeschwindigkeit, Dauer und Kraftstoffverbrauch. – My BMW App Support Team",2022-09-13 13:39:07,1.6.2,German,"Since the last update, the app barely works at all anymore. Uninstalling and reinstalling doesn't help either. It's a shame, because now you can’t even see when the vehicle is fully charged. Sad, after the forced change of the Connected Drive App, consumption data were already not visible, now absolutely nothing works anymore. We’ll uninstall the whole thing and definitely won’t recommend it. Undignified for a premium manufacturer. Thank goodness the iX3 is better.",negative,"performance, vehicle status, updates, charging management, ev-specific features",ev_hybrid,experienced_user,casual_user,yes,no,ix3
725f449d-af19-4f7a-ab1b-af9c2d41490f,Kai Wuestenhagen,https://play-lh.googleusercontent.com/a-/ALV-UjWxJic_trVnGnApg0Y6DjWlmmgO5NJmhjKwCveyX5Ty7dFZQn7l,"Fein, ich sehe wieviel Liter noch im Tank sind, das ist genauer als Tankanzeige im Auto, ausserdem wird mir der Standort des PKW angezeigt",5,0,1.6.2,2021-11-07 06:39:37,,,1.6.2,German,"Nice, I can see how many liters are left in the tank, which is more accurate than the fuel gauge in the car, plus the location of the vehicle is displayed.",positive,"vehicle status, connectivity",combustion,unclear,casual_user,no,no,none
